L1: see note
A2: microL loaded | B2: Bandname | C2: microg | D2: X1 | E2: X2 | F2: Y1 | G2: Y2 | H2: area | I2: integral intensity | J2: bcg/px | K2: corrected | L2: ng/band
A3: 2 | B3: APP OG (42microL) | D3: 71 | E3: 104 | F3: 165 | G3: 178 | H3: =(E3-D3-2)*(G3-F3-2) -> 341 | I3: 19851 | K3: =I3-H3*$J$9 -> 1866.8020833333321 | L3: =K3/653.29 -> 2.8575396582426369
A4: 2.2 | B4: APP OG Bj35 (48microL) | D4: 113 | E4: 146 | F4: 166 | G4: 177 | H4: =(E4-D4-2)*(G4-F4-2) -> 279 | I4: 16486 | K4: =I4-H4*$J$9 -> 1771.65625 | L4: =K4/653.29 -> 2.7118986208268918
A5: 3 | B5: APP+BACE (50microL) | D5: 151 | E5: 188 | F5: 168 | G5: 181 | H5: =(E5-D5-2)*(G5-F5-2) -> 385 | I5: 22581 | K5: =I5-H5*$J$9 -> 2276.2604166666642 | L5: =K5/653.29 -> 3.484303168067266
A6: 40 | B6: BACE Alx488 (60microL) | D6: 199 | E6: 231 | F6: 265 | G6: 300 | H6: =(E6-D6-2)*(G6-F6-2) -> 990 | I6: 59649 | K6: =I6-H6*$J$9 -> 7436.8125 | L6: =K6/653.29 -> 11.383631312280917
B7: BACEdimer | D7: 198 | E7: 234 | F7: 129 | G7: 150 | H7: =(E7-D7-2)*(G7-F7-2) -> 646 | I7: 41049 | K7: =I7-H7*$J$9 -> 6979.2291666666642 | L7: =K7/653.29 -> 10.683202202186877
B8: Band6 | C8: 2E-3 | D8: 243 | E8: 280 | F8: 166 | G8: 180 | H8: =(E8-D8-2)*(G8-F8-2) -> 420 | I8: 22784 | K8: =I8-H8*$J$9 -> 633.375 | L8: =K8/653.29 -> 0.96951583523396967
B9: bcg | C9: 0 | D9: 248 | E9: 282 | F9: 185 | G9: 199 | H9: =(E9-D9-2)*(G9-F9-2) -> 384 | I9: 20252 | J9: =I9/H9 -> 52.739583333333336 | K9: =I9-H9*$J$9 -> 0 | L9: =K9/653.29 -> 0.0
B10: Band8 | C10: 6.0000000000000001E-3 | D10: 288 | E10: 322 | F10: 166 | G10: 181 | H10: =(E10-D10-2)*(G10-F10-2) -> 416 | I10: 24357 | K10: =I10-H10*$J$9 -> 2417.3333333333321 | L10: =K10/653.29 -> 3.7002454244414156
B11: Band9 | C11: 1.2500000000000001E-2 | D11: 330 | E11: 364 | F11: 167 | G11: 179 | H11: =(E11-D11-2)*(G11-F11-2) -> 320 | I11: 23242 | K11: =I11-H11*$J$9 -> 6365.3333333333321 | L11: =K11/653.29 -> 9.7435033956333825
B12: Band10 | C12: 2.5000000000000001E-2 | D12: 372 | E12: 405 | F12: 166 | G12: 181 | H12: =(E12-D12-2)*(G12-F12-2) -> 403 | I12: 36351 | K12: =I12-H12*$J$9 -> 15096.947916666664 | L12: =K12/653.29 -> 23.109106088669144
B13: Band11 | C13: 00.05 | D13: 413 | E13: 448 | F13: 167 | G13: 185 | H13: =(E13-D13-2)*(G13-F13-2) -> 528 | I13: 58921 | K13: =I13-H13*$J$9 -> 31074.5 | L13: =K13/653.29 -> 47.56616510278743
B14: 10microLAOG | D14: 588 | E14: 620 | F14: 176 | G14: 190 | H14: =(E14-D14-2)*(G14-F14-2) -> 360 | I14: 35153 | K14: =I14-H14*$J$9 -> 16166.75 | L14: =K14/653.29 -> 24.746666870761839
A15: 10 | B15: APP OG (42microL) | D15: 633 | E15: 660 | F15: 176 | G15: 186 | H15: =(E15-D15-2)*(G15-F15-2) -> 200 | I15: 21219 | K15: =I15-H15*$J$9 -> 10671.083333333332 | L15: =K15/653.29 -> 16.334374218698176
A16: 10 | B16: APP+BACE (50microL) | D16: 634 | E16: 659 | F16: 204 | G16: 216 | H16: =(E16-D16-2)*(G16-F16-2) -> 230 | I16: 15443 | K16: =I16-H16*$J$9 -> 3312.8958333333321 | L16: =K16/653.29 -> 5.0710952767275366